{
  "schemaVersion": "1.3",
  "title": "48小时项目推进",
  "description": "按阶段推进核心任务",
  "capability": "mission",
  "estimatedMinutes": 10,
  "sourceRef": {
    "sourceId": "fixture_mission",
    "contentHash": "4a77354a2653ca9b1950046af589301087423edb1abfac15bdcd78ba0a5cfa56"
  },
  "program": {
    "model": "gated_path",
    "primitives": ["observable_state", "material_artifact"],
    "initialState": "scoped",
    "terminalState": "mvp_ready",
    "states": [
      {"id": "scoped", "label": "范围已确定"},
      {"id": "mvp_ready", "label": "最小版本已形成"}
    ],
    "transitions": [
      {"from": "scoped", "componentId": "task_scope", "when": "completed", "to": "mvp_ready"},
      {"from": "mvp_ready", "componentId": "task_demo", "when": "completed", "to": "mvp_ready"},
      {"from": "mvp_ready", "componentId": "task_mvp", "when": "completed", "to": "mvp_ready"}
    ]
  },
  "components": [
    {
      "id": "task_scope",
      "type": "task",
      "required": true,
      "title": "确定核心场景",
      "source": {
        "blockId": "fixture_block_mission_000",
        "quote": "前期先确定核心场景和演示路径",
        "startOffset": 0,
        "endOffset": 14,
        "blockHash": "4a77354a2653ca9b1950046af589301087423edb1abfac15bdcd78ba0a5cfa56"
      }
    },
    {
      "id": "task_demo",
      "type": "task",
      "required": true,
      "title": "确定演示路径",
      "source": {
        "blockId": "fixture_block_mission_000",
        "quote": "确定核心场景和演示路径",
        "startOffset": 3,
        "endOffset": 14,
        "blockHash": "4a77354a2653ca9b1950046af589301087423edb1abfac15bdcd78ba0a5cfa56"
      }
    },
    {
      "id": "task_mvp",
      "type": "task",
      "required": true,
      "title": "完成最小可用版本",
      "source": {
        "blockId": "fixture_block_mission_000",
        "quote": "再完成最小可用版本",
        "startOffset": 15,
        "endOffset": 24,
        "blockHash": "4a77354a2653ca9b1950046af589301087423edb1abfac15bdcd78ba0a5cfa56"
      }
    }
  ],
  "completion": {
    "type": "all_required_completed",
    "targetId": null
  },
  "resultArtifact": {
    "type": "mission_snapshot",
    "fields": [
      "completedTasks",
      "totalTasks",
      "remainingTaskIds"
    ]
  }
}
