{
  "schemaVersion": "1.3",
  "title": "入住前检查",
  "description": "逐项完成现场检查",
  "capability": "inspect",
  "estimatedMinutes": 5,
  "inputs": [{"id": "fixture_text", "type": "textarea", "label": "测试文本", "required": true, "maxLength": 500}],
  "sourceRef": {
    "sourceId": "fixture_inspect",
    "contentHash": "32722291a9d40becd5252b880d4a854cf80a22ba3789ed3c3b7fdbf116476557"
  },
  "components": [
    {
      "id": "check_water",
      "type": "check",
      "required": true,
      "title": "检查水压",
      "source": {
        "blockId": "fixture_block_inspect_000",
        "quote": "同时打开两个用水点观察水压是否明显下降",
        "startOffset": 8,
        "endOffset": 27,
        "blockHash": "fc486decbff852582bf367f86ad1b2028a2be42a95bd2d70c80760ba848aa3dd"
      },
      "evaluation": {"inputId": "fixture_text", "operator": "required"}
    },
    {
      "id": "check_leak",
      "type": "check",
      "required": true,
      "title": "检查水渍",
      "source": {
        "blockId": "fixture_block_inspect_001",
        "quote": "检查窗边和墙角是否存在明显水渍",
        "startOffset": 1,
        "endOffset": 16,
        "blockHash": "2bf6030edca46b0669f88354490fce0f70dd7a04e2c40ef6fe8adfb5f67bdbf7"
      },
      "evaluation": {"inputId": "fixture_text", "operator": "length_between", "params": {"min": 1, "max": 500}}
    },
    {
      "id": "check_identity",
      "type": "check",
      "required": true,
      "title": "核对出租人身份",
      "source": {
        "blockId": "fixture_block_inspect_002",
        "quote": "签约前建议核对出租人身份信息",
        "startOffset": 0,
        "endOffset": 14,
        "blockHash": "0a5611330335e58f52e31a54fe52b53b66ecc0e00a354b681db900c923844826"
      },
      "evaluation": {"inputId": "fixture_text", "operator": "manual_evidence"}
    }
  ],
  "completion": {
    "type": "all_required_completed",
    "targetId": null
  },
  "resultArtifact": {
    "type": "inspect_summary",
    "fields": [
      "normalCount",
      "riskCount",
      "uncheckedCount",
      "items"
    ]
  }
}
